{
  "clip_id": "video24_cp006",
  "video_id": "video24",
  "fps": 29.97002997002997,
  "start_frame": 0,
  "end_frame": 58,
  "source_frame_offset": 270,
  "first_appearance_definition": "The first visible portion within the clip that is identifiable and can be temporally matched to that subject; frame numbering starts at 0.",
  "entities": [
    {
      "source_entity_id": "video24_e001",
      "name": "Person A",
      "numbered": true,
      "first_appearance_frame": 0,
      "identification": "In frame 0 of this clip, Person A is in the near lower-left. A person with short dark hair, wearing a blue-gray top with rolled-up sleeves, brown trousers, and brown crossed shoulder straps; tracked by clothing and continuous action, with position subject to change with the camera."
    },
    {
      "source_entity_id": "video24_e002",
      "name": "Person B",
      "numbered": true,
      "first_appearance_frame": 0,
      "identification": "The other person who continuously interacts with Person A in this clip. A person with relatively short gray-brown hair, wearing a dark crew-neck short-sleeved top and dark trousers; does not have Person A's crossed shoulder straps and continuously interacts with Person A while holding a sword."
    },
    {
      "source_entity_id": "video24_e003",
      "name": "Sword A",
      "numbered": true,
      "first_appearance_frame": 2,
      "identification": "The sword held by Person A, identified by Person A's grip on it and continuous action; a long curved blade and a metal guard near the hand are visible."
    },
    {
      "source_entity_id": "video24_e004",
      "name": "Sword B",
      "numbered": true,
      "first_appearance_frame": 0,
      "identification": "The sword held by Person B, identified by Person B's grip on it and continuous action; its designation does not change based on whether it is at the top or bottom of the image or on momentary reflections."
    },
    {
      "source_entity_id": "video24_e005",
      "name": "Wooden Plank Floor",
      "numbered": false,
      "first_appearance_frame": null,
      "identification": "The continuous wooden plank surface beneath the people and between them, with seams extending into the distance; excludes the stairs above, the Pillar, and scattered metal objects."
    },
    {
      "source_entity_id": "video24_e006",
      "name": "Metal Debris on the Ground",
      "numbered": false,
      "first_appearance_frame": null,
      "identification": "The collection of disc-shaped and irregular small metal objects scattered and piled on the Wooden Plank Floor; individual objects are not numbered, and Sparks from Clashing Swords in the air are excluded."
    },
    {
      "source_entity_id": "video24_e007",
      "name": "Pillar",
      "numbered": false,
      "first_appearance_frame": null,
      "identification": "Thick upright columnar structural elements indoors, visible at the sides and in the background; defined separately from the closely spaced rods of the Grating."
    },
    {
      "source_entity_id": "video24_e008",
      "name": "Background Wall Rack",
      "numbered": false,
      "first_appearance_frame": null,
      "identification": "The background structure composed of large dark wall surfaces, frame edges, and elevated beam racks behind the people, excluding the separately defined Pillar, Grating, Background Stairs, and Box."
    },
    {
      "source_entity_id": "video24_e010",
      "name": "Background Stairs",
      "numbered": false,
      "first_appearance_frame": null,
      "identification": "The stairs in the background composed of several horizontal steps rising progressively, located behind the people and excluding ordinary floorboard seams."
    },
    {
      "source_entity_id": "video24_e011",
      "name": "Box",
      "numbered": false,
      "first_appearance_frame": null,
      "identification": "The collection of low rectangular box-like containers in the background, with square frames, metal edges, and open or tilted lid surfaces visible; only the areas visible in this clip are counted."
    },
    {
      "source_entity_id": "video24_e012",
      "name": "Flames",
      "numbered": false,
      "first_appearance_frame": null,
      "identification": "Orange-yellow tongues of fire visible near the Pillar, wall rack, and background edges; excludes the white flashes and brief sparks that appear when the swords clash."
    },
    {
      "source_entity_id": "video24_e013",
      "name": "Sparks from Clashing Swords",
      "numbered": false,
      "first_appearance_frame": null,
      "identification": "Bright fragments and short streaks that briefly scatter near where the two swords meet, appearing and dissipating with the sword-clashing action; excludes stationary Metal Debris on the Ground and environmental Flames."
    }
  ],
  "items": [
    {
      "item_key": "video24_cp006_a0001",
      "statement": "In frame 0, the corresponding people are Person A and Person B, two people in total.",
      "category": "object_presence",
      "levels": [
        "L1",
        "L2",
        "L3"
      ],
      "start_frame": 0,
      "end_frame": 0,
      "evidence_frames": [
        0
      ],
      "subject_ids": [
        "video24_e001",
        "video24_e002"
      ]
    },
    {
      "item_key": "video24_cp006_a0002",
      "statement": "In frame 0, the subject or area corresponding to Sword B is visible.",
      "category": "object_presence",
      "levels": [
        "L1"
      ],
      "start_frame": 0,
      "end_frame": 0,
      "evidence_frames": [
        0
      ],
      "subject_ids": [
        "video24_e004"
      ]
    },
    {
      "item_key": "video24_cp006_a0003",
      "statement": "In frame 0, Sword B is visible in the image.",
      "category": "object_presence",
      "levels": [
        "L2",
        "L3"
      ],
      "start_frame": 0,
      "end_frame": 0,
      "evidence_frames": [
        0
      ],
      "subject_ids": [
        "video24_e004"
      ]
    },
    {
      "item_key": "video24_cp006_a0004",
      "statement": "In frame 0, the subject or area corresponding to the Wooden Plank Floor is visible.",
      "category": "object_presence",
      "levels": [
        "L1"
      ],
      "start_frame": 0,
      "end_frame": 0,
      "evidence_frames": [
        0
      ],
      "subject_ids": [
        "video24_e005"
      ]
    },
    {
      "item_key": "video24_cp006_a0005",
      "statement": "In frame 0, the Wooden Plank Floor is visible in the image.",
      "category": "object_presence",
      "levels": [
        "L2",
        "L3"
      ],
      "start_frame": 0,
      "end_frame": 0,
      "evidence_frames": [
        0
      ],
      "subject_ids": [
        "video24_e005"
      ]
    },
    {
      "item_key": "video24_cp006_a0006",
      "statement": "In frame 0, the subject or area corresponding to the Metal Debris on the Ground is visible.",
      "category": "object_presence",
      "levels": [
        "L1"
      ],
      "start_frame": 0,
      "end_frame": 0,
      "evidence_frames": [
        0
      ],
      "subject_ids": [
        "video24_e006"
      ]
    },
    {
      "item_key": "video24_cp006_a0007",
      "statement": "In frame 0, the Metal Debris on the Ground is visible in the image.",
      "category": "object_presence",
      "levels": [
        "L2",
        "L3"
      ],
      "start_frame": 0,
      "end_frame": 0,
      "evidence_frames": [
        0
      ],
      "subject_ids": [
        "video24_e006"
      ]
    },
    {
      "item_key": "video24_cp006_a0008",
      "statement": "In frame 0, the subject or area corresponding to the Pillar is visible.",
      "category": "object_presence",
      "levels": [
        "L1"
      ],
      "start_frame": 0,
      "end_frame": 0,
      "evidence_frames": [
        0
      ],
      "subject_ids": [
        "video24_e007"
      ]
    },
    {
      "item_key": "video24_cp006_a0009",
      "statement": "In frame 0, the Pillar is visible in the image.",
      "category": "object_presence",
      "levels": [
        "L2",
        "L3"
      ],
      "start_frame": 0,
      "end_frame": 0,
      "evidence_frames": [
        0
      ],
      "subject_ids": [
        "video24_e007"
      ]
    },
    {
      "item_key": "video24_cp006_a0010",
      "statement": "In frame 0, the subject or area corresponding to the Background Wall Rack is visible.",
      "category": "object_presence",
      "levels": [
        "L1"
      ],
      "start_frame": 0,
      "end_frame": 0,
      "evidence_frames": [
        0
      ],
      "subject_ids": [
        "video24_e008"
      ]
    },
    {
      "item_key": "video24_cp006_a0011",
      "statement": "In frame 0, the Background Wall Rack is visible in the image.",
      "category": "object_presence",
      "levels": [
        "L2",
        "L3"
      ],
      "start_frame": 0,
      "end_frame": 0,
      "evidence_frames": [
        0
      ],
      "subject_ids": [
        "video24_e008"
      ]
    },
    {
      "item_key": "video24_cp006_a0012",
      "statement": "In frame 0, the subject or area corresponding to the Background Stairs is visible.",
      "category": "object_presence",
      "levels": [
        "L1"
      ],
      "start_frame": 0,
      "end_frame": 0,
      "evidence_frames": [
        0
      ],
      "subject_ids": [
        "video24_e010"
      ]
    },
    {
      "item_key": "video24_cp006_a0013",
      "statement": "In frame 0, the Background Stairs are visible in the image.",
      "category": "object_presence",
      "levels": [
        "L2",
        "L3"
      ],
      "start_frame": 0,
      "end_frame": 0,
      "evidence_frames": [
        0
      ],
      "subject_ids": [
        "video24_e010"
      ]
    },
    {
      "item_key": "video24_cp006_a0014",
      "statement": "In frame 0, the subject or area corresponding to the Box is visible.",
      "category": "object_presence",
      "levels": [